id,type,sectionId,sectionName,webPublicationDate,webTitle,webUrl
world/2025/may/02/israel-says-airstrikes-in-syria-are-message-to-protect-druze-minority,article,world,World news,2025-05-02T22:33:05Z,Israel says airstrikes in Syria are ‘message’ to protect Druze minority,https://www.theguardian.com/world/2025/may/02/israel-says-airstrikes-in-syria-are-message-to-protect-druze-minority
world/2025/may/02/afd-extremist-label-sets-up-political-high-wire-act-for-friedrich-merz,article,world,World news,2025-05-02T18:22:14Z,AfD ‘extremist’ label sets up political high-wire act for Friedrich Merz,https://www.theguardian.com/world/2025/may/02/afd-extremist-label-sets-up-political-high-wire-act-for-friedrich-merz
world/2025/may/02/israel-launches-airstrikes-near-syria-presidential-palace-in-damascus,article,world,World news,2025-05-02T17:59:05Z,Syria calls Israeli air strikes on Damascus a ‘dangerous escalation’,https://www.theguardian.com/world/2025/may/02/israel-launches-airstrikes-near-syria-presidential-palace-in-damascus
world/2025/may/02/canada-mark-carney-king-charles,article,world,World news,2025-05-02T16:31:12Z,King Charles to open Canada parliament as PM Carney reacts to Trump threats,https://www.theguardian.com/world/2025/may/02/canada-mark-carney-king-charles
world/2025/may/02/gaza-humanitarian-aid-ship-bombed-drones-waters-off-malta,article,world,World news,2025-05-02T14:15:19Z,Gaza humanitarian aid ship ‘bombed by drones’ in waters off Malta,https://www.theguardian.com/world/2025/may/02/gaza-humanitarian-aid-ship-bombed-drones-waters-off-malta
world/2025/may/02/scottish-ministers-drop-plans-outlaw-misogyny-conversion-practices,article,world,World news,2025-05-02T14:04:26Z,Scottish ministers drop plans to outlaw misogyny and conversion practices,https://www.theguardian.com/world/2025/may/02/scottish-ministers-drop-plans-outlaw-misogyny-conversion-practices
world/live/2025/may/02/russia-ukraine-us-minerals-romania-vatican-conclave-europe-news-live-updates,liveblog,world,World news,2025-05-02T14:02:26Z,Germany’s far-right AfD to challenge ‘extremist’ designation – as it happened,https://www.theguardian.com/world/live/2025/may/02/russia-ukraine-us-minerals-romania-vatican-conclave-europe-news-live-updates
world/2025/may/02/german-spy-agency-afd-confirmed-rightwing-extremist-force,article,world,World news,2025-05-02T10:53:18Z,German spy agency labels AfD as ‘confirmed rightwing extremist’ force,https://www.theguardian.com/world/2025/may/02/german-spy-agency-afd-confirmed-rightwing-extremist-force
world/2025/may/02/we-want-the-fear-to-end-a-palestinian-widow-relives-the-trauma-of-loss-and-struggle-for-survival,article,world,World news,2025-05-02T08:00:28Z,"Gaza blockade: a Palestinian widow, her children and a cupboard that is almost bare",https://www.theguardian.com/world/2025/may/02/we-want-the-fear-to-end-a-palestinian-widow-relives-the-trauma-of-loss-and-struggle-for-survival
world/2025/may/02/auction-of-ancient-indian-gems-imbued-with-living-presence-of-buddha-condemned,article,world,World news,2025-05-02T08:00:02Z,Auction of ancient Indian gems ‘imbued with presence of Buddha’ condemned,https://www.theguardian.com/world/2025/may/02/auction-of-ancient-indian-gems-imbued-with-living-presence-of-buddha-condemned
world/2025/may/02/cia-china-videos-communist-party-spying-recruitment,article,world,World news,2025-05-02T06:33:56Z,‘For a better life’: CIA releases videos to lure disgruntled CCP officials to spy on China,https://www.theguardian.com/world/2025/may/02/cia-china-videos-communist-party-spying-recruitment
world/2025/may/02/friday-briefing-reform-takes-labour-scalp-in-knife-edge-runcorn-by-election,article,world,World news,2025-05-02T05:59:13Z,Friday briefing: Reform takes Labour scalp in knife-edge Runcorn byelection,https://www.theguardian.com/world/2025/may/02/friday-briefing-reform-takes-labour-scalp-in-knife-edge-runcorn-by-election
world/2025/may/02/mummy-mystery-solved-air-dried-priest-was-embalmed-via-rectum,article,world,World news,2025-05-02T04:00:00Z,Mummy mystery solved: ‘air-dried’ priest was embalmed via rectum,https://www.theguardian.com/world/2025/may/02/mummy-mystery-solved-air-dried-priest-was-embalmed-via-rectum
world/2025/may/02/ukraine-war-briefing-zelenskyy-hails-historic-minerals-deal-as-an-equal-partnership-with-us,article,world,World news,2025-05-02T00:09:27Z,Ukraine war briefing: Zelenskyy hails ‘historic’ minerals deal as an equal partnership with US,https://www.theguardian.com/world/2025/may/02/ukraine-war-briefing-zelenskyy-hails-historic-minerals-deal-as-an-equal-partnership-with-us
world/2025/may/01/israel-must-give-access-to-jailed-palestinians-uk-tells-world-court,article,world,World news,2025-05-01T18:49:24Z,"Israel must give Red Cross access to jailed Palestinians, Britain tells ICJ",https://www.theguardian.com/world/2025/may/01/israel-must-give-access-to-jailed-palestinians-uk-tells-world-court
world/2025/may/01/trump-administration-readies-first-sale-of-military-equipment-to-ukraine,article,world,World news,2025-05-01T17:47:15Z,Trump administration readies first sale of military equipment to Ukraine,https://www.theguardian.com/world/2025/may/01/trump-administration-readies-first-sale-of-military-equipment-to-ukraine
world/live/2025/may/01/ukraine-war-live-updates-minerals-deal-us-trump-zelenskyy-latest-news,liveblog,world,World news,2025-05-01T17:35:38Z,"Trump approves first weapons shipment to Ukraine since becoming president, report says, after minerals deal agreed – as it happened",https://www.theguardian.com/world/live/2025/may/01/ukraine-war-live-updates-minerals-deal-us-trump-zelenskyy-latest-news
world/2025/may/01/second-italian-journalist-allegedly-targeted-with-mercenary-spyware,article,world,World news,2025-05-01T14:00:21Z,Second Italian journalist allegedly targeted with ‘mercenary spyware’,https://www.theguardian.com/world/2025/may/01/second-italian-journalist-allegedly-targeted-with-mercenary-spyware
world/2025/may/01/mps-to-vote-on-decriminalisation-of-abortion-in-england-and-wales,article,world,World news,2025-05-01T12:50:13Z,MPs set to vote on decriminalising abortion in England and Wales,https://www.theguardian.com/world/2025/may/01/mps-to-vote-on-decriminalisation-of-abortion-in-england-and-wales
world/2025/may/01/fist-fights-ghostly-pranks-and-schism-a-brief-history-of-conclaves-past,article,world,World news,2025-05-01T12:36:17Z,"Fist fights, ghostly pranks and schism: a brief history of conclaves past",https://www.theguardian.com/world/2025/may/01/fist-fights-ghostly-pranks-and-schism-a-brief-history-of-conclaves-past
