id,type,sectionId,sectionName,webPublicationDate,webTitle,webUrl
world/2025/jun/04/indian-students-shock-trump-international-study-visa,article,world,World news,2025-06-03T23:01:49Z,‘They are in shock’: Indian students fear Trump has ended their American dream,https://www.theguardian.com/world/2025/jun/04/indian-students-shock-trump-international-study-visa
world/2025/jun/03/harvey-weinstein-sex-crimes-trial-closing,article,world,World news,2025-06-03T22:08:00Z,Closing arguments begin in sexual misconduct trial of Harvey Weinstein,https://www.theguardian.com/world/2025/jun/03/harvey-weinstein-sex-crimes-trial-closing
world/2025/jun/03/gaza-humanitarian-foundation-chair-johnnie-moore,article,world,World news,2025-06-03T19:58:32Z,Gaza Humanitarian Foundation names US evangelical leader as new chair,https://www.theguardian.com/world/2025/jun/03/gaza-humanitarian-foundation-chair-johnnie-moore
world/2025/jun/03/austrian-newspaper-cuts-ties-with-writer-over-clint-eastwood-exclusive,article,world,World news,2025-06-03T18:15:25Z,Austrian newspaper cuts ties with writer over Clint Eastwood ‘exclusive’,https://www.theguardian.com/world/2025/jun/03/austrian-newspaper-cuts-ties-with-writer-over-clint-eastwood-exclusive
world/2025/jun/03/major-evacuation-in-cologne-after-second-world-war-bombs-discovered,article,world,World news,2025-06-03T17:50:51Z,Major evacuation in Cologne after second world war bombs discovered,https://www.theguardian.com/world/2025/jun/03/major-evacuation-in-cologne-after-second-world-war-bombs-discovered
world/2025/jun/03/masked-israeli-troops-block-media-visit-to-west-bank-site-of-oscar-winning-film-no-other-land,article,world,World news,2025-06-03T17:34:39Z,Masked Israeli troops block media visit to West Bank site of Oscar-winning film,https://www.theguardian.com/world/2025/jun/03/masked-israeli-troops-block-media-visit-to-west-bank-site-of-oscar-winning-film-no-other-land
world/2025/jun/03/lee-jae-myung-child-labourer-to-leader-deeply-scarred-south-korea,article,world,World news,2025-06-03T16:55:25Z,Lee Jae-myung: from child labourer to leader of deeply scarred South Korea,https://www.theguardian.com/world/2025/jun/03/lee-jae-myung-child-labourer-to-leader-deeply-scarred-south-korea
world/2025/jun/03/lee-jae-myung-elected-as-south-korean-president-exit-polls-say,article,world,World news,2025-06-03T16:51:38Z,Lee Jae-myung wins election as South Korean president,https://www.theguardian.com/world/2025/jun/03/lee-jae-myung-elected-as-south-korean-president-exit-polls-say
world/2025/jun/03/britain-must-stand-ready-to-recognise-somaliland,article,world,World news,2025-06-03T16:48:39Z,Britain must stand ready to recognise Somaliland | Letter,https://www.theguardian.com/world/2025/jun/03/britain-must-stand-ready-to-recognise-somaliland
world/2025/jun/03/in-defence-of-canada-and-its-war-efforts,article,world,World news,2025-06-03T16:48:23Z,In defence of Canada and its war efforts | Letter,https://www.theguardian.com/world/2025/jun/03/in-defence-of-canada-and-its-war-efforts
world/2025/jun/03/palestinians-killed-israeli-fire-aid-point-gaza-officials-say,article,world,World news,2025-06-03T16:39:30Z,"At least 27 Palestinians killed by Israeli fire at food point, Gaza officials say",https://www.theguardian.com/world/2025/jun/03/palestinians-killed-israeli-fire-aid-point-gaza-officials-say
world/live/2025/jun/03/europe-live-dutch-netherlands-far-right-leader-geert-wilders-quits-ukraine-russia-poland,liveblog,world,World news,2025-06-03T16:11:23Z,Dutch prime minister Dick Schoof steps down after Geert Wilders quits government – as it happened,https://www.theguardian.com/world/live/2025/jun/03/europe-live-dutch-netherlands-far-right-leader-geert-wilders-quits-ukraine-russia-poland
world/2025/jun/03/sudan-darfur-rapid-support-forces-rsf-attack-un-aid-convoy-el-fasher-al-koma,article,world,World news,2025-06-03T15:49:10Z,‘Multiple casualties’ reported after attack on UN aid convoy in Darfur,https://www.theguardian.com/world/2025/jun/03/sudan-darfur-rapid-support-forces-rsf-attack-un-aid-convoy-el-fasher-al-koma
world/2025/jun/04/e-scooter-injury-toll-revealed-in-study-just-tip-of-the-iceberg-in-australia-doctors-warn,article,world,World news,2025-06-03T15:00:40Z,"E-scooter injury toll revealed in study just ‘tip of the iceberg’ in Australia, doctors warn",https://www.theguardian.com/world/2025/jun/04/e-scooter-injury-toll-revealed-in-study-just-tip-of-the-iceberg-in-australia-doctors-warn
world/2025/jun/03/laila-soueif-defiant-in-face-of-death-hunger-strike-alaa-abd-el-fattah,article,world,World news,2025-06-03T15:00:39Z,"Laila Soueif, on 247th day of hunger strike for jailed British-Egyptian son, defiant in face of death",https://www.theguardian.com/world/2025/jun/03/laila-soueif-defiant-in-face-of-death-hunger-strike-alaa-abd-el-fattah
world/2025/jun/03/netherlands-government-collapse-geert-wilders,article,world,World news,2025-06-03T14:46:26Z,Dutch government collapses as far-right leader pulls party out of coalition,https://www.theguardian.com/world/2025/jun/03/netherlands-government-collapse-geert-wilders
world/2025/jun/03/rijksmuseum-condom-exhibition,article,world,World news,2025-06-03T13:55:34Z,Dutch museum to display 200-year-old condom probably made from sheep’s appendix,https://www.theguardian.com/world/2025/jun/03/rijksmuseum-condom-exhibition
world/2025/jun/03/outrage-over-arrest-of-kenyan-software-developer-rose-njeri-as-regional-repression-grows,article,world,World news,2025-06-03T13:34:40Z,Outrage over arrest of Kenyan software developer as regional repression grows,https://www.theguardian.com/world/2025/jun/03/outrage-over-arrest-of-kenyan-software-developer-rose-njeri-as-regional-repression-grows
world/2025/jun/03/ukraine-hits-bridge-linking-crimea-to-russia-with-underwater-explosives,article,world,World news,2025-06-03T13:16:31Z,Ukraine hits bridge linking Crimea to Russia with underwater explosives,https://www.theguardian.com/world/2025/jun/03/ukraine-hits-bridge-linking-crimea-to-russia-with-underwater-explosives
world/2025/jun/03/france-terrorism-investigation-tunisian-hairdresser-shot-dead-alleged-racist-act-hichem-miraoui,article,world,World news,2025-06-03T13:06:59Z, France opens terror case after Tunisian hairdresser shot dead in ‘racist act’,https://www.theguardian.com/world/2025/jun/03/france-terrorism-investigation-tunisian-hairdresser-shot-dead-alleged-racist-act-hichem-miraoui
