id,type,sectionId,sectionName,webPublicationDate,webTitle,webUrl
world/live/2025/jun/18/iran-israel-live-updates-air-strikes-tehran-trump-khamenei-middle-east-latest-news,liveblog,world,World news,2025-06-19T00:46:13Z,Trump says Iran deal ‘could still happen’ and claims Tehran was ‘a few weeks away’ from nuclear weapon – Israel-Iran conflict live,https://www.theguardian.com/world/live/2025/jun/18/iran-israel-live-updates-air-strikes-tehran-trump-khamenei-middle-east-latest-news
world/2025/jun/19/cambodia-bans-fruit-imports-and-soap-operas-from-thailand-as-border-dispute-sours,article,world,World news,2025-06-18T23:41:27Z,Cambodia bans fruit imports and soap operas from Thailand as border dispute sours,https://www.theguardian.com/world/2025/jun/19/cambodia-bans-fruit-imports-and-soap-operas-from-thailand-as-border-dispute-sours
world/2025/jun/18/iran-threatens-us-with-irreparable-damage-if-trump-joins-war,article,world,World news,2025-06-18T22:28:06Z,Trump undecided on joining war on Iran as Khamenei warns him not to attack,https://www.theguardian.com/world/2025/jun/18/iran-threatens-us-with-irreparable-damage-if-trump-joins-war
world/2025/jun/18/british-german-and-french-foreign-ministers-plan-meeting-with-iranian-counterpart,article,world,World news,2025-06-18T22:04:59Z,"British, German and French foreign ministers plan meeting with Iranian counterpart",https://www.theguardian.com/world/2025/jun/18/british-german-and-french-foreign-ministers-plan-meeting-with-iranian-counterpart
world/2025/jun/18/air-india-survivor-attends-brothers-funeral-as-investigators-examine-planes-emergency-systems,article,world,World news,2025-06-18T19:40:33Z,Air India survivor carries brother’s coffin amid questions over plane’s emergency systems,https://www.theguardian.com/world/2025/jun/18/air-india-survivor-attends-brothers-funeral-as-investigators-examine-planes-emergency-systems
world/2025/jun/18/iranian-opposition-supporters-grapple-with-us-and-israeli-regime-change-plans,article,world,World news,2025-06-18T18:08:31Z,Iranian opposition supporters grapple with US and Israeli regime change plans,https://www.theguardian.com/world/2025/jun/18/iranian-opposition-supporters-grapple-with-us-and-israeli-regime-change-plans
world/2025/jun/18/canada-india-assassination-carney-modi,article,world,World news,2025-06-18T17:53:44Z,Canadian intelligence accuses India over Sikh’s killing as Carney meets Modi,https://www.theguardian.com/world/2025/jun/18/canada-india-assassination-carney-modi
world/2025/jun/18/concerns-mount-as-brits-in-israel-told-to-stay-put-while-embassy-families-flown-out,article,world,World news,2025-06-18T17:42:33Z,Fears voiced as Britons in Israel advised to stay while embassy families depart,https://www.theguardian.com/world/2025/jun/18/concerns-mount-as-brits-in-israel-told-to-stay-put-while-embassy-families-flown-out
world/2025/jun/18/israels-iran-war-us-join-trump,article,world,World news,2025-06-18T17:38:09Z,Israel’s assumption US would get drawn into Iran war is being put to the test,https://www.theguardian.com/world/2025/jun/18/israels-iran-war-us-join-trump
world/2025/jun/18/meps-attend-budapest-pride-viktor-orban-hungary-lgbtq,article,world,World news,2025-06-18T17:12:46Z,Dozens of MEPs to attend Budapest Pride in defiance of Viktor Orbán,https://www.theguardian.com/world/2025/jun/18/meps-attend-budapest-pride-viktor-orban-hungary-lgbtq
world/2025/jun/18/iranian-regime-collapse-would-be-serious-blow-for-russia,article,world,World news,2025-06-18T16:52:45Z,Iranian regime collapse would be serious blow for Russia,https://www.theguardian.com/world/2025/jun/18/iranian-regime-collapse-would-be-serious-blow-for-russia
world/live/2025/jun/18/ukraine-russia-g7-donald-trump-volodymyr-zelenskyy-latest-europe-live-news-updates,liveblog,world,World news,2025-06-18T16:20:39Z,Death toll from Russian attack on Kyiv rises to 28 – as it happened,https://www.theguardian.com/world/live/2025/jun/18/ukraine-russia-g7-donald-trump-volodymyr-zelenskyy-latest-europe-live-news-updates
world/2025/jun/18/israeli-forces-kill-injure-palestinians-food-trucks-gaza-officials,article,world,World news,2025-06-18T16:17:08Z,"Israeli forces kill 11 Palestinians awaiting food trucks, say Gaza officials",https://www.theguardian.com/world/2025/jun/18/israeli-forces-kill-injure-palestinians-food-trucks-gaza-officials
world/2025/jun/19/for-australians-stranded-in-israel-with-planes-grounded-nights-are-the-most-unnerving,article,world,World news,2025-06-18T15:00:55Z,"For Australians stranded in Israel with planes grounded, nights are the most unnerving",https://www.theguardian.com/world/2025/jun/19/for-australians-stranded-in-israel-with-planes-grounded-nights-are-the-most-unnerving
world/2025/jun/18/trump-yemen-bombings-killed-civilians-us-attacks-analysis,article,world,World news,2025-06-18T13:28:32Z,"Trump’s Yemen bombings killed nearly as many civilians as 23 previous years of US attacks, analysis shows",https://www.theguardian.com/world/2025/jun/18/trump-yemen-bombings-killed-civilians-us-attacks-analysis
world/2025/jun/18/cornish-man-ben-corser-shot-dead-mexico-in-wrong-place-at-wrong-time-inquest-hears,article,world,World news,2025-06-18T12:45:26Z,"Cornish man shot dead in Mexico ‘in wrong place at wrong time’, inquest hears",https://www.theguardian.com/world/2025/jun/18/cornish-man-ben-corser-shot-dead-mexico-in-wrong-place-at-wrong-time-inquest-hears
world/2025/jun/18/what-two-photographs-reveal-about-keir-starmer-at-g7-summit,article,world,World news,2025-06-18T10:19:55Z,Starmer proves adept at juggling egos and issues at tricky G7 summit,https://www.theguardian.com/world/2025/jun/18/what-two-photographs-reveal-about-keir-starmer-at-g7-summit
world/2025/jun/18/saudi-arabia-turki-al-jasser-executed,article,world,World news,2025-06-18T07:00:06Z,A Saudi journalist tweeted against the government – and was executed for ‘high treason’,https://www.theguardian.com/world/2025/jun/18/saudi-arabia-turki-al-jasser-executed
world/2025/jun/18/wednesday-briefing-how-trumps-unpredictability-is-shaping-the-middle-east-crisis,article,world,World news,2025-06-18T05:50:09Z,Wednesday briefing: How Trump’s unpredictability​ is ​shaping the Middle East crisis,https://www.theguardian.com/world/2025/jun/18/wednesday-briefing-how-trumps-unpredictability-is-shaping-the-middle-east-crisis
world/2025/jun/18/discarded-clothes-from-uk-brands-dumped-in-protected-ghana-wetlands,article,world,World news,2025-06-18T05:00:04Z,Discarded clothes from UK brands dumped in protected Ghana wetlands,https://www.theguardian.com/world/2025/jun/18/discarded-clothes-from-uk-brands-dumped-in-protected-ghana-wetlands
