id,type,sectionId,sectionName,webPublicationDate,webTitle,webUrl
world/2025/may/26/new-zealand-resources-minister-shane-jones-mining-environment,article,world,World news,2025-05-26T00:36:18Z,"New Zealand will not be ‘guilt-tripped’ over environment, resources minister says",https://www.theguardian.com/world/2025/may/26/new-zealand-resources-minister-shane-jones-mining-environment
world/2025/may/25/deadly-missile-and-drone-strikes-batter-kyiv-for-second-night,article,world,World news,2025-05-25T22:31:44Z,Ukraine condemns US ‘silence’ after Russia’s biggest air raid of war,https://www.theguardian.com/world/2025/may/25/deadly-missile-and-drone-strikes-batter-kyiv-for-second-night
world/2025/may/25/almost-200-marilyn-monroe-lookalikes-join-irish-charity-swim,article,world,World news,2025-05-25T18:25:10Z,Almost 200 Marilyn Monroe lookalikes join Irish charity swim,https://www.theguardian.com/world/2025/may/25/almost-200-marilyn-monroe-lookalikes-join-irish-charity-swim
world/2025/may/25/gaza-doctor-last-goodbye-nine-children-killed-airstrike,article,world,World news,2025-05-25T18:24:18Z,‘One of the most heartbreaking tragedies’: Gaza doctor’s last goodbye before nine children killed in airstrike,https://www.theguardian.com/world/2025/may/25/gaza-doctor-last-goodbye-nine-children-killed-airstrike
world/2025/may/25/french-authorities-investigate-power-blackout-blamed-on-sabotage,article,world,World news,2025-05-25T16:46:31Z,French authorities investigate second power blackout in two days,https://www.theguardian.com/world/2025/may/25/french-authorities-investigate-power-blackout-blamed-on-sabotage
world/live/2025/may/25/ukraine-russia-largest-air-attack-war-kyiv-live-news-updates,liveblog,world,World news,2025-05-25T13:39:59Z,Ukraine war: ‘US silence encourages Putin’ says Zelenskyy after largest Russian attack to date – as it happened,https://www.theguardian.com/world/live/2025/may/25/ukraine-russia-largest-air-attack-war-kyiv-live-news-updates
world/2025/may/25/ukraine-russia-complete-1000-for-1000-prisoner-exchange,article,world,World news,2025-05-25T10:56:19Z,"Ukraine and Russia complete ‘1,000 for 1,000’ prisoner exchange",https://www.theguardian.com/world/2025/may/25/ukraine-russia-complete-1000-for-1000-prisoner-exchange
world/2025/may/25/us-silence-russia-steps-up-attacks-ukraine-highlights-trump-failure,article,world,World news,2025-05-25T10:03:03Z,Trump silence as Russia steps up attacks on Ukraine highlights diplomatic failure,https://www.theguardian.com/world/2025/may/25/us-silence-russia-steps-up-attacks-ukraine-highlights-trump-failure
world/2025/may/25/delegation-of-labour-mps-arrives-in-taiwan-in-first-visit-since-uk-election,article,world,World news,2025-05-25T07:00:22Z,Delegation of Labour MPs arrives in Taiwan in first visit since UK election,https://www.theguardian.com/world/2025/may/25/delegation-of-labour-mps-arrives-in-taiwan-in-first-visit-since-uk-election
world/2025/may/25/irish-pro-palestine-activists-embrace-paddystinian-term-as-badge-of-honour,article,world,World news,2025-05-25T07:00:21Z,Irish pro-Palestine activists embrace ‘Paddystinian’ term as badge of honour,https://www.theguardian.com/world/2025/may/25/irish-pro-palestine-activists-embrace-paddystinian-term-as-badge-of-honour
world/2025/may/25/western-quolls-and-brushtail-possums-thrive-in-national-park-a-decade-after-reintroduction,article,world,World news,2025-05-25T00:00:13Z,Western quolls and brushtail possums thrive in national park a decade after reintroduction,https://www.theguardian.com/world/2025/may/25/western-quolls-and-brushtail-possums-thrive-in-national-park-a-decade-after-reintroduction
world/2025/may/24/israeli-airstrike-kills-nine-of-gaza-doctors-10-children-reports-say,article,world,World news,2025-05-24T18:46:58Z,Israeli airstrike kills nine of Gaza doctor’s 10 children,https://www.theguardian.com/world/2025/may/24/israeli-airstrike-kills-nine-of-gaza-doctors-10-children-reports-say
world/live/2025/may/24/israel-gaza-war-middle-east-latest-news-updates-netanyahu-hamas,liveblog,world,World news,2025-05-24T14:55:48Z,Israeli soldiers accused of widespread use of human shields in Gaza – as it happened,https://www.theguardian.com/world/live/2025/may/24/israel-gaza-war-middle-east-latest-news-updates-netanyahu-hamas
world/2025/may/24/israel-investigates-use-of-palestinians-as-human-shields-by-its-forces-in-gaza,article,world,World news,2025-05-24T12:34:41Z,Israel investigates use of Palestinians as human shields by its forces in Gaza,https://www.theguardian.com/world/2025/may/24/israel-investigates-use-of-palestinians-as-human-shields-by-its-forces-in-gaza
world/2025/may/24/russia-drone-attack-kyiv-ukraine-war,article,world,World news,2025-05-24T11:38:25Z,Russia launches one of biggest drone attacks on Kyiv since start of war,https://www.theguardian.com/world/2025/may/24/russia-drone-attack-kyiv-ukraine-war
world/2025/may/24/india-border-security-force-troops-shoot-pakistani-man-frontier-border-gujarat,article,world,World news,2025-05-24T09:06:16Z,"Indian troops shoot dead Pakistani man crossing frontier, officials say",https://www.theguardian.com/world/2025/may/24/india-border-security-force-troops-shoot-pakistani-man-frontier-border-gujarat
world/2025/may/24/trump-russia-sanctions-europe-ukraine,article,world,World news,2025-05-24T09:00:55Z,Trump’s Russia sanctions refusal leaves Europe with few options but to wait ,https://www.theguardian.com/world/2025/may/24/trump-russia-sanctions-europe-ukraine
world/2025/may/24/you-feel-useful-to-society-italy-umarell-busybody-pensioners-go-professional,article,world,World news,2025-05-24T08:42:50Z,‘You feel useful to society’: Italy’s busybody pensioners go professional,https://www.theguardian.com/world/2025/may/24/you-feel-useful-to-society-italy-umarell-busybody-pensioners-go-professional
world/2025/may/24/alarming-rise-in-regional-internet-censorship-in-china-study-finds,article,world,World news,2025-05-24T04:00:48Z,"‘Alarming’ rise in regional internet censorship in China, study finds",https://www.theguardian.com/world/2025/may/24/alarming-rise-in-regional-internet-censorship-in-china-study-finds
world/2025/may/24/poland-presidential-debate-puts-ukraine-and-europe-centre-stage,article,world,World news,2025-05-23T23:54:04Z,Poland presidential debate puts Ukraine and Europe centre stage,https://www.theguardian.com/world/2025/may/24/poland-presidential-debate-puts-ukraine-and-europe-centre-stage
